,Title,Publication,URL,Content
13,Would-be thief hospitalized after putting hot burritos up his rectum in 7-eleven store,World News Daily Report,https://worldnewsdailyreport.com/would-be-thief-hospitalized-after-putting-hot-burritos-up-his-rectum-in-7-eleven-store/,"A man’s attempt to steal three burning hot burritos from a 7-eleven convenience store turned horribly wrong last night in Flint, Michigan, leading the poor man to the hospital with second and third-degree burns inside his rectal cavity.

According to witnesses, 26-year old Jason Morrison was visibly drunk when he entered the store around 10:30 PM last night to get some food.

It seems the young man was both short on money and judgment, as he decided to take three hot burritos and stuff them up his rectal cavity to carry them out of the store.

Flint Police spokesman, Lieutenant Dan Ashbury, described the following events in a press conference this morning.

“As soon as he shoved the items up his rectum, he threw himself to the ground holding his butt, and he began crying and screaming.”

Lt. Ashbury says it took witnesses a few minutes to understand what was happening and someone called 911.

“He kept screaming that his ass was burning and he was going to die. I think everyone just thought he was on drugs or suffered from violent diarrhea.”

Mr. Morrison was transported to the Mc Laren Regional Medical Center where doctors were able to extract the burritos and stabilize his condition.

He suffers from second and third-degree burns and will necessitate at least two reconstructive surgeries before he is able to defecate normally again.

Fortunately for him, since the total value of the merchandise that he stole amounts to less than 10$, no criminal charges will be filed against him."
14,Brunei man arrested on charges of ‘gay conspiracy’ for selling DVD copies of Broke Back Mountain,World News Daily Report,https://worldnewsdailyreport.com/brunei-man-arrested-on-charges-of-gay-conspiracy-for-selling-dvd-copies-of-broke-back-mountain/,"A Brunei man is facing 160 years in jail after authorities seized over 400 DVDs deemed as “homosexual propaganda” by the state, reports the Kalimantan Press this morning.

Analak Hmong Lau, 43, was arrested this morning during a raid on his DVD store which specializes in American movies.

Amongst the titles seized by police and labeled as “homosexual propaganda” were copies of “Broke Back Mountain, Boogie Nights, Lord of the Rings and all Harry Potter movies” reports the Kalimantan Press.

“Movies promoting openly homosexual themes, gay characters or which employ gay actors portraying fictitious characters are deemed homosexual propaganda by the state,” one Brunei official told reporters.

“It is important that children are not exposed to material which makes homosexual conduct acceptable, that is why only material where homosexuality is punished, either by lashing, lapidation or torture is deemed appropriate,” one Brunei state official said.

One such child show made in partnership with the Brunei government and scheduled for next September will show Brunei’s first “openly gay muppet character” have announced the producers last month.

Keldai, a homosexual donkey, will be used to educate children on the “dangers of homosexuality and deviant manners” and “will suffer many hardships, such as lapidation, electroshock, and decapitation every show” to entice children to follow the “path of Islam” explained one producer of the upcoming show.

Brunei is a Muslim-majority former British protectorate on the north of Borneo Island with a population of around 400,000.

Early this month it began implementing Sharia laws that punish sodomy, adultery and rape with the death penalty – including by stoning, and theft with amputation."
